title,selftext,score,num_comments,created_utc,url,subreddit,flair,comments
Pepe AI Meme Coin,[removed],1,2,2023-05-08 16:42:17,,SatoshiStreetBets,Moonshot (low market cap)  🚀,"[('/u/Dependent-Emu-4303, to prevent spam, your SatoshiStreetBets submission has been removed due to your **comment** karma being less than 200. Please remember **comment** karma is different than your total combined karma. You can learn more about the [different types of karma here](https://reddit.zendesk.com/hc/en-us/articles/204511829-What-is-karma-) You can build up comment karma by making quality comments across Reddit. If you have a questions, please feel free to send the SSB moderators a (nice) modmail.\n\n*I am a bot, and this action was performed automatically. Please [contact the moderators of this subreddit](/message/compose/?to=/r/SatoshiStreetBets) if you have any questions or concerns.*', 1), ('Your post has been removed **NOT** because there was anything wrong with it, but rather **general housekeeping - Moonshot Monday entries are now closed and we are cleaning up the front page for other content**\n\n\nSSB must sometimes cycle through posts which have already ""had their turn"" on the front page to make room for addition, rising submissions. There is limited real estate and we do not want posts which have already been quite visible from crowding out whatever is in the pipeline. \n\n**Your post remains accessible to anyone with the link,** and the existing conversations and threads will continue. You should feel free to share the post link.\n\nThank you for your understanding while we keep the sub fresh with a regular cycle of contributions and lessen the chance of becoming stale.', 1)]"
Is the meme coin season already over or are we just getting started?,"In terms of price increases, the past few weeks have been crazy. Not only have memecoins flourished but SUI also started trading and while I was expecting this turn of events to push the markets even higher we are testing new lows and memecoins have retraced by 50% and some even more.



Some argue that coins like PEPE are just a passing fad but if BitMEX finds them attractive enough to [list them on futures markets](https://thedefiant.io/bitmex-announces-the-listing-of-two-new-perpetual-contracts-pepe-and-sui) surely they can’t be a one-hit wonder, right?",88,43,2023-05-08 17:39:40,,SatoshiStreetBets,Discussion 🦍,"[('We are certainly at an extraordinary phase of the market. It seems like memecoins found their footing a bit too late because BTC was already preparing for a downward move for quite some time now.\n\n\nI honestly think memecoins, especially these new ones, will bounce back from this crash but no one can say when. Some traders I know are already looking for long entries but you know what they say about catching falling knives…', 17), ('Like 2021, the meme craze marks the top.', 3), ('These things bring a lot of liquidity with them. The trading volume is the only legitimacy indicator IMO. Yes, a BitMEX listing is surely a boost for your reputation but they wouldn’t even consider listing the coin if people didn’t express heavy interest in trading it.\n\n\nPeople want PEPE on leverage and BitMEX gives them just that.', 1), ('[deleted]', 2), ('[deleted]', 0), ('POOH 🔥🔥🔥', 18), ('Both Pepe and SUI hit the market at the worst time possible it seems. I’ll be waiting for a BTC consolidation before I start playing with fire.', 3), ('Noot 🚀🚀🚀', 13), (""It's over, not enough free cash flow out there to risk buying risky assets like meme coins."", 0), ('I think meme season is over and I took profit already from trading memes, now I’m buying CYMI for my long term hold', 1), ('Just getting started especially for $Bog which most people haven’t given attention to yet or realize that it was one of the OG memes along with Pepe and Wojak', 3), ('Love $pooh 💜', 4), ('I think there are some that still have a great opp to 🚀🚀🚀 way further. Pooh is my absolute favorite in that regard. Also there’s this teeeeeeny 25k micro cap that just launched 3 hours ago that has a really impressive looking website, TG, Twitter etc. Pulk.vip is the site.', 2), ('Ssssssnek.', 0), ('[deleted]', 1), ('I advise you take your profit from the memecoins already. I believe we will experience another alt season pretty soon and from the look of the market, investing in privacy coins and privacy focused projects might be a very good move.', 3), ('I’m putting a bet on Gigachad being the next meme to rocket. 650k mc, launched last week, and saw some good volume over the weekend. Gigachad.world.', 1), ('[removed]', 1), ('[removed]', 1), ('PepeAI just broke the pinksale presale record yesterday 👀', 0), ('I think it\'s not over yet. It\'s the time for ""The Next Something"" narrative.', 1), (""They will bounce back when bull finally gets here but for now, I think they've had their run. Funds will slowly move back to alts. It's time to pay attention to products and what's going to lead the next bull like AI and RWA for instance. Those are good narratives, and projects like MniCorp has both covered. Fingers crossed."", 1), ('[removed]', 1), (""Sadly it's meme coin season every day."", 2), ('Peepo for the win !!', 0), ('[removed]', 1), ('Syke 😂😂😂', 0), ('[removed]', 1), ('[removed]', 1), ('[removed]', 1), ('[removed]', 1), (""I don't think so. Did you see $BEN?"", 1), (""It's just getting started imo"", 1), ('[removed]', 1), ('There’s a meme coin season?', 1), ('&gt;I advise you take your profit from the memecoins already\n\nI already did before it started dropping, and increased my Zcash, Sylo and Beam bags because I honestly think privacy focused projects have the potential to make a big impact in the crypto market', 1), ('[removed]', 1), (""I guess it is ending already. A lot of people lose in the meme and just a little people gain from it. I lost a lot in a few and made some 3x from others. I'll stick to safer bags. I'll stick to the likes of CTSI, CYMI, and HBAR."", 1), ('[removed]', 1), ('I believe that memes, in general, are a temporary trend, regardless of which exchange lists them. By the way, SUI is not a memecoin. However, if you want to invest in memecoins, the best approach is to set a target and sell your position as soon as you reach it. For me, any profits made from investing in memecoins are reinvested into my long-term portfolio with assets like ETH, LINK, or DIA. Hopefully, we will soon enter the altseason and start seeing consistent green days again.', 1), (""Yeah, making the most of the season is worth it, but I'd always suggest we pull out when necessary because this doesn't have what it takes to hold for long. I've been moving mine to a sustainable yield system, precisely NFE on Polygon, a tokenized RWA. I'm waiting for fundamentals to pick up shortly when Bitcoin does, but the concern is when."", 0), ('You are right.', 1), (""I'm not touching PEPE, but it looks like SUI features as a Top100 within the Blockchain infrastructure category. Fantom is my favorite pick from this category, but I'm also focusing on DeFi with Beefy and Dafi, and GameFi with Elfin Kingdom and Splinterlands. I'm combining big players with high-potential projects in my portfolio."", 1), ('Now money can start flowing into actual projects. DCA  into and solid mid-caps like VRA, INJ, and ORE.', 1), ('[removed]', 1), (""As far as I know, we just getting started with BRC-20 meme becoming more popular and now we've got PIZA to watch now. Gonna be listed on Bitget tomorrow to coincide with Bitcoin pizza day"", 1)]"
"IF YOU WAS NOT EARLY TO $PEPE, YOU DO NOT WANT TO MISS THIS!!!",[removed],1,1,2023-05-08 19:39:19,,SatoshiStreetBets,Moonshot (low market cap)  🚀,"[('/u/Business-Eye-6999, to prevent spam, your SatoshiStreetBets submission has been removed due to your **comment** karma being less than 200. Please remember **comment** karma is different than your total combined karma. You can learn more about the [different types of karma here](https://reddit.zendesk.com/hc/en-us/articles/204511829-What-is-karma-) You can build up comment karma by making quality comments across Reddit. If you have a questions, please feel free to send the SSB moderators a (nice) modmail.\n\n*I am a bot, and this action was performed automatically. Please [contact the moderators of this subreddit](/message/compose/?to=/r/SatoshiStreetBets) if you have any questions or concerns.*', 1)]"
"Missed buying $PEPE? No worries as you still buy $POOH by @poohmoneyHQ, the next $PEPE. With a market cap below $50M, it's still early to invest now with more than 10K holders and continuously growing every day. Join diamond hands #poohcrew at https://t.me/poohmoneyHQ and start enjoying honey gains.",,1,0,2023-05-09 12:56:09,,SatoshiStreetBets,Moonshot (low market cap)  🚀,[]
"You can never be late with $POOH if you invest now. Buy the dip! For zero fees, you can buy $POOH with major exchanges like BitMart, Huobi, Poloniex, and Lbank. $POOH will be the next $PEPE so don't ever miss it. Join https://t.me/poohmoneyHQ to enjoy honey gains with the #poohcrew.",,1,0,2023-05-09 13:59:14,,SatoshiStreetBets,Moonshot (low market cap)  🚀,[]
New token in Bsc Pepe-Roni,[removed],1,1,2023-05-09 23:08:16,,SatoshiStreetBets,Meme 😂,"[(""We're removing your post under [`Sub Rule #1`](https://www.reddit.com/r/SatoshiStreetBets/wiki/contentguide#wiki_rule_1_.7C_project_listing_thresholds). While this project may be tracked, it is still a few days too young to be on SSB. The **minimum project age is 7d**, and this is the uncommon project to obtain a tracked listing in such a short amount of time.\n\nWhy don't you discuss it over at r/satoshistreetdegens for a few more days?\n\nThanks for understanding, and questions may be directed [to modmail.](https://www.reddit.com/r/SatoshiStreetBets/wiki/contentguide#wiki_about_modmail)"", 1)]"
$CHAD COIN is the only memecoin launched exactly the same time as Pepe and Wojak that has not mooned yet. all 3 were also listed the same day on Huobi exchange as well. just saying. I don't know if there is a connection but its all too coincidental.,,2,2,2023-05-10 01:47:57,,SatoshiStreetBets,Meme 😂,"[('I actually bought this, the Twitter is @chadcoindex a ton of fakes have popped up in recent days but that’s the one that launched with Pepe/Wojak. I think a top 5 Pepe holder also bought a few ETH worth last week too? Idk if it’s the same dev but I wouldn’t be shocked if it was.', 2), ('[removed]', 1)]"
"Missed buying $PEPE? No worries as you still buy $POOH by @poohmoneyHQ, the next $PEPE. With a market cap below $50M, it's still early to invest now with more than 10K holders and continuously growing every day. Join diamond hands #poohcrew at https://t.me/poohmoneyHQ and start enjoying honey gains.",,1,13,2023-05-10 02:09:32,,SatoshiStreetBets,Meme 😂,"[('What can I use to buy?', -2), ('UniSwap', 1), ('Who‘s gonna tell him it‘s not going to work out?', 6), ('Nah. Rally is done. Anyone who buys now is just providing exit liquidity', 4), ('Ummm... catgirl coin.', 1), ('$RIZZ is a much better option', 1), ('Looks like he bought at the top.', 3), ('Look at marketcap of Pepe and look at marketcap of $Pooh there is still a long way to go - mostly cause the Poocrew has a community built…', 0), ('[removed]', 1), ('There’s no Pooh crew man.  They had a Pooh crew and they took their money.  I was a very early investor and made out nice.  Bought in at a 4m MC, holder number 700.  It was a great ride, but it wasn’t nearly what it should have been.  The whales hit 100x and started to DCA out.  Don’t provide them exit liquidity; and if you are still in cut your loses because it’s going down baby.', 0), ('So, $POOH is done man.  Show the real chart.  😂 The whales have been DCA’ing out for sometime now.  The charts, and holder data show it pretty clearly.', 1), ('Same mindset as the people who sold btc at 19k and then didn’t buy in at the bottom before it shot up to 60k', 1), ('There’s an enormous difference.  Memes run on momentum, and momentum alone.  Once they’ve lost it, it’s over. At this point anyone who’s still holding is down, and hoping to one day get back to even.  It’s literally set up right now as a buy in so I can cash out type of coin.', 1)]"
Pepe… Here We Go Again!!! 🤷‍♂️🐸,,2,7,2023-05-10 03:48:22,,SatoshiStreetBets,Meme 😂,"[('[deleted]', 2), (""It's done, you are all exit liquidity"", 5), ('thank me later 🙏 https://www.youtube.com/watch?v=scff8VmkN0Y', 0), ('![gif](giphy|JLyCEdvJ8KYCdKuZfP)', 2), ('You were from the start', 1), (""Since you posted this it's down big. Anyone who bought I hope loses everything"", 1), ('Only buy on the dip broski. Common sense 😂\n#bighint\n\n\nMost smart people tend to put their toes in the water before making a full dive in. Words of wisdom for dip seekers.', 1), ('![gif](giphy|h0MTqLyvgG0Ss)', 1)]"
Profiting from Memecoins vs. Building a Solid Crypto Portfolio for the Long Term,"With the recent meme season, we've seen how some people were able to make quick profit by buying and selling meme coins like PEPE. While it's great to see people making money in the crypto space, it's important to remember that investing in a meme coin is about having fun and not getting in with HODL mentality like we do for altcoins. 

Instead of investing in memecoins, it's better to focus on altcoins with utility. These projects have real-world applications and are more likely to hold their value over time. For example, Allianceblock and Polygon developed ZKPs, which enable decentralized identity solutions for the financial industry. Curve and Aave are coming up with new innovations that are pushing the boundaries of DeFi and helping to pave the way for a more decentralized financial system. These are practical and in-demand use cases for blockchain technology that has the potential for long-term growth.

Building a solid crypto portfolio with long-term holdings is a more sustainable strategy than chasing the latest meme trend. While it may take longer to see significant gains, investing in coins with real utility and a strong development team is a more reliable way to build wealth over time.

As we look toward the future of the crypto market, it's difficult to predict which area will be the next focus - Gamefi, Defi, or Metaverse. However, by building a diversified portfolio with strong long-term holdings, we can position ourselves to benefit from whatever trends come our way.

So, Are you ready to build a portfolio for the future? Let's discuss in the comments below!",33,22,2023-05-10 09:34:36,,SatoshiStreetBets,Discussion 🦍,"[('Sir, this is a casino.', 13), ('I look at it like this.\n\nWe need more money from memecoins into utility projects.\n\nFor instance, the guy who invested $2m in pepe before binance listing, also invested in a presales of an utility project because of that, many investors took their profit from pepe and invested in the presales of the that project.\n\nThis is money from memecoins being spread to an utilty project, it is good for the crypto ecosystem', 1), ('Money is money. If you are able to make millions from meme coins, by all means do so.', 3), ('Even in a casino, some players lose why some players win, those that win still go on to help the economy by investing in small businesses or in real estate, this same logic is also similar in the crypto ecosystem. \n\nThose who wins in the memecoin casino will spread their gains in the real economy and also in some utility projects', 2), (' I agree with you, wli think we rationalize things alot rather than just play the game', 1), (""I think building a solid portfolio with blue-chip cryptocurrencies is certainly the way to go. That's why I only invest in ButtCoin."", 2), ('Buttcoin is scam token without liquidity', 1), ('The BNB ButtCoin yes, but not r/ButtCoinASA', 1), ('So true. Better to make millions in whatever way than watch others make it. I hold a few low caps like ORE and also memes like BOB and wojak. I hope they all pull through.', 1), ('Allready up 4x on Chance (bsc), I like quick casino profits', 1), ('i prefer profit', 1), ('[removed]', 1), (""I'm building my portfolio and I try to diversify as much as possible with a little bias for DeFi because it has always prevailed in all seasons. We might have a bull market soon and I'm expecting 5x from each gem. HBAR, SPOOL, and CTSI."", 1), (""I'm here for money. in 20 years, the only thing that will matter to you is that you have money.  You will forget about all utilities, because they are irrelevant to you as an individual.  of all cryptocurrencies, I earned the most on shitcoins, and it was also quite fast.  when I entered the crypto world 2 years ago, if I had invested everything in utility altcoins, now I would have a drop of at least 70%.  fuck hodling."", 2), (""I'm interested in both short-term and long-term profits. Obviously, memecoins are my short-term play. For my long-term play, I'm keeping an eye on projects that provide real value, such as MNI Corp, which is one of the RWAs I'm interested in. What about you?"", 1), (""I wonder who doesn't have a portfolio of good gems, don't be deceived everyone has both investments. I use crypto AI platform to build my portfolio but that doesn't stop me from buying memecoins too, infact I also get which memecoins to buy from the platform."", 1), (""It's great to see those projects developing ZKPs technology. These kinds of projects have the potential for significant long-term growth, and I think investing in them is a smart move for anyone looking to build wealth in the crypto space."", 1), (""It's great to see those projects developing ZKPs technology. These kinds of projects have the potential for significant long-term growth, and I think investing in them is a smart move for anyone looking to build wealth in the crypto space."", 1), (""It's great to see those projects developing ZKPs technology. These kinds of projects have the potential for significant long-term growth, and I think investing in them is a smart move for anyone looking to build wealth in the crypto space."", 1), (""Honestly, I'm focused on building a solid portfolio. I prefer solid investments, rather than gambling with meme coins. We're here for profit, but tech is also important if you really believe in the potential of this space. When it comes to the next big trend, I think both DeFi and GameFi will do well. Considering Binance-backed projects Star Sharks and Elfin Kingdoms things look promising for web3 gaming enthusiasts. The Elfin Arcade model is cool innovation since it will bring on &amp; off-chain games. Let's see how it plays out."", 1), ('I completely agree with you, holding meme coins for a long period of  time is generally not advisable, the individual you mentioned made a  wise decision.\n\nIf real-life utility tokens received the same level of liquidity and attention as meme coins, we would witness the transformative changes we desire. This is why I am personally holding Sylo, as its decentralized utilities, security, and privacy features play a crucial role in our communication needs.', 1), ('[deleted]', 1), ('Wow', 1)]"
Meme Coin Investing 2.0: How Copium Crypto (COPE) is Disrupting the Traditional Crypto Market,"Hey everyone, have you heard about the Copium Crypto token (COPE)? It's the successor of the popular Pepe meme coin $PEPE. 

&amp;#x200B;

Unfortunately, internal conflicts in $PEPE caused a fall in their market cap and a lot of investors were left disappointed. However, Copium Crypto is here to take the good parts of PEPE and improve on them for the benefit of small investors. 

&amp;#x200B;

The message of Pepe will live on through COPE, but with the added potential for small investors to make it big. Unlike $PEPE, COPE has low transaction fees on the Binance Smart Chain, which is great news for those who have been put off by the enormous Ethereum transaction fees associated with $PEPE. 

&amp;#x200B;

So, if you're looking for the next generation of meme coins that will appeal to small investors and have the potential to make a big impact, then COPE is definitely worth checking out. Join the Copium Crypto community today and see what the hype is about!

&amp;#x200B;

🌍 Website with everything important:

[getcopium.com](https://getcopium.com)",0,1,2023-05-10 13:35:20,,SatoshiStreetBets,Discussion 🦍,"[('[removed]', 1)]"
"On-chain analytics tool Lookonchain says three whales started to accumulate pepe tokens earlier this week amid a nearly 50% price cut. “3 whales started to buy $PEPE after the price dropped,” Lookonchain tweeted.",0x50C1 withdrew 1.4T $PEPE ($2.76M) from Binance when the price was $0.000002054.”  CoinGecko data shows PEPE has seen over $420 million traded in the past 24 hours as prices fell steeply before rebounding.,1,0,2023-05-10 19:48:50,,SatoshiStreetBets,News 📰,[]
