title,selftext,score,num_comments,created_utc,url,subreddit,flair,comments
The most degen of Crypto Twitter traders seem to be moving past Shiba Inu-fashioned tokens to those branded after the internet meme Pepe the Frog.,,33,20,2023-04-18 21:07:26,,SatoshiStreetBets,News 📰,"[('[deleted]', 1), ('Some early PEPE users have turned a few hundred dollars to six figures on the latest meme obsession.\n\nThe token launched Sunday ran over 21,000% in the past three days, raking in $30 million in trading volumes on Uniswap and reaching a market capitalization of as high as $33 million on Tuesday morning.\n\n“The most memeable memecoin in existence. The dogs have had their day, it’s time for Pepe to take reign,” the Pepe website says.\n\nThe tokens have no connection to the actual Pepe the Frog meme or Matt Furie, the meme’s original creator.\n\nWe’ve got what you want to know about the latest meme token craze at the link in bio.', 1), ('[deleted]', 1), ('Some early PEPE users have turned a few hundred dollars to six figures on the latest meme obsession.\n\nThe token launched Sunday ran over 21,000% in the past three days, raking in $30 million in trading volumes on Uniswap and reaching a market capitalization of as high as $33 million on Tuesday morning.\n\n“The most memeable memecoin in existence. The dogs have had their day, it’s time for Pepe to take reign,” the Pepe website says.\n\nThe tokens have no connection to the actual Pepe the Frog meme or Matt Furie, the meme’s original creator.\n\nhttps://www.coindesk.com/markets/2023/04/18/pepe-the-frog-memecoins-rocket-as-crypto-twitter-moves-over-doge-obsession/', 1), ('\nThe most degen of Crypto Twitter traders seem to be moving past Shiba Inu-fashioned tokens to those branded after the internet meme Pepe the Frog.\n\nSome early PEPE users have turned a few hundred dollars to six figures on the latest meme obsession.\n\nThe token launched Sunday ran over 21,000% in the past three days, raking in $30 million in trading volumes on Uniswap and reaching a market capitalization of as high as $33 million on Tuesday morning.\n\nThe tokens have no connection to the actual Pepe the Frog meme or Matt Furie, the meme’s original creator. \n\nhttps://www.coindesk.com/markets/2023/04/18/pepe-the-frog-memecoins-rocket-as-crypto-twitter-moves-over-doge-obsession/', -1), ('[removed]', 1), ('Nah, tamadoge about to be up over 200%, still undiscovered and about to be listed on a top 5 exchange', -5), ('$hitcoin season boys and girls!', 1), ('The battle of memecoins. dog vs pepe', 1), ('[removed]', 1), ('[removed]', 1), ('What the actual fuck? Seriously, is this an intentional attempt to ruin crypto further?', 1), ('What the actual fuck? Seriously, is this an intentional attempt to ruin crypto further?', 1), ('Not good in trading but Shiba Inu will produce millionaires in the future if the platform last longer', -3), ('There are still a lot of degens in the market, so this is not a big surprise. Maybe this will start the new meme season. What do you think?', 2), ('What about floki and bad mitten Asia 2023?', 1), ('Hey does anyone know the toke quote? Imma buy a few dollars just to be on the safe side', 1), ('Lol dream on', 3), ('[removed]', 1), ('[removed]', 1), ('[removed]', 1), ('[removed]', 1), (""Memecoins are still in existence, and this narrative may not end anytime soon, but I still favor the one that has real-world applications, like as MNI Corp's tokenization of tangible assets so that users can access them on a more liquid and safe platform. I only bite memecoins for short term but the chance is less."", 1), ('[removed]', 1), ('https://preview.redd.it/tkoohptiqfva1.jpeg?width=815&amp;format=pjpg&amp;auto=webp&amp;s=3c83fb53487479d4fcd6a16ff65298cb0197c01a', 2)]"
Are we in the Memecoin Bull season?,"Many memecoin are pumping, the notable one of them was pepe which might have launched 5 days ago, now has a marketcap of $142M ,volume of $152M and more than 29k holders.

Infact, there is a post of someone who made $1m after investing $25 in pepe, this made me remember the bull run season of 2021 where some early buyers of shiba and safemoon made huge sum of money by investing $200.

The success of pepe token has also lead to imitations and pump of various meme tokens like $mpepe, $chad and others.

I just wanna know, are we in the memecoin bull season  considering the fact that many memecoin has risen in value or alk these token  are just pump and dump?",18,55,2023-04-20 11:19:13,,SatoshiStreetBets,Discussion 🦍,"[('Yep and Tama following right behind with about about 1/6th of that market cap', 0), ('Banano still flat though', 3), ('Banano still flat though', 1), (""Tama hasn't pump since after presales"", 0), ('Looks like you’re a bit behind the times…check the charts now my guy it’s about to get listed on a tier 1 exchange', 0), ('[removed]', 1), ('i bought during presales and the price has fallen far below listing price.', 0), ('As a wizard once taught me, learn to hold', 0), ('not on a memecoin', 2), ('[removed]', 1), ('Where do you see that increase? When I check online on coingeko or others I only see a 400% increase and to go from 25 to 1M you would need a 4000000% increase', 3), ('No.', 1), ('We sure are - Satoshiswap one of the best opportunities out there.  Definitely look into and buy a bag', 2), ('Awww was about to check v_v 🍌the biggest benis of them all', 3), ('It’s called retail FOMO season.', 3), (""No, we are in a bull market for legitimate projects, but people still invest in memecoins as a quick way to make money. To invest in the right projects, you need to know about them before they launch. I might try some memecoins, but I'm also looking at long-term investments like LINK, DIA, ARB, and others. No matter what you invest in, it takes time to see results."", 0), ('[removed]', 1), ('Fuck no, not even close. Half the people in pepe have to wait to sell because there is fuck all for liquidity. Pepe just did well with marketing. Lots of coins do that every month and then crash and burn. Remember bonk?', 6), ('Fuck no', 2), ('https://preview.redd.it/57rra39ul4va1.jpeg?width=1080&amp;format=pjpg&amp;auto=webp&amp;s=173fe3fb0fe81a8ded9b919919862bf69f46be8a', 2), ('[removed]', 1), ('Quick way to lose money you mean', 1), ('DERPY next', 3), ('F*ck yeah we are. Meme coins are 24/7 and defy financial gravity. 420 #babydogeceo #dogeceo #frogceo', 0), ('[removed]', 1), (""We might be. Memes are good when you catch them early and also exit when you should. Good to make quick profits but never for long term. I do gamble from time to time but I still have long term tokens I hold (BTC, ETH, ARB) etc and I pay attention to trends too. RWA tokenisation seems to be the current one and MNICorp is one of those implementing it, and on defi. I'm still navigating the waters on that."", 1), ('You are right. PEPE and AIDOGE did really well. I just hope the main bull run begins. It will be massive as most projects are rolling out new developments. NXRA and AUDIO have been keeping up with the trend.', 1), ('[removed]', 1), ('[removed]', 1), ('[removed]', 1), ('[removed]', 1), (""CG and CMC  dont track from launch.  That's why you dont see the insane increase"", 1), (""Pepe listed on 3 cex's almost right away.  That's not cheap to do. It may have been a fair launch...but loads of cash behind those projects"", 1), ('Be sure to do thorough research because they  comes with risks, as most of them are swiftly replaced by a new trend. This is why my portfolio is only 5% memes, and the rest filled with solid alts with real-world use cases like Ethereum, Bmi, Monero, and Sylo, to name a few.', 1), ('[removed]', 1), ('It launched at a 1k mcap as I heard. I personally saw it at $2.5M mcap &amp; ignored it.', 1), (""Well, I don't expect to see the next SHIB until the next bull. But maybe we are in their season already, not sure.\n\nFundamentals always win in the end, so I would still be exposed to ETH, MATIC &amp; upcoming tokens on my watchlist; ADE &amp; PEG."", 1), (""The market is volatile, you can make or lose money. It's part of the game."", 1), ('Yeah. I know mine is less than 5%. hahaha', 1), (""When it comes to fundamentals, I keen to those with widely adopted solution in reality like that of the crypto payment solution with thousands of merchants integrating the innovative technology into their platforms for their consumer's daily usage and not some upcoming watchlist that might fail to fulfill their promises."", 1), (""Not seeing any sign for that, though I've thrown some money I can afford to lose on it, atm my main focus is getting more Metaverse tokens, especially those ones with an active ecosystem like RIDE for holoride, RoboEra, and a few others."", 1), (""Memecoins will remain always be PNDs besides there's no bull season anywhere just yet. I believe fundamentals will thrive more in the next bull season as more people are focused on important topics such as privacy, identity solutions and AI."", 1), ('I agree, its takes a lot of money to get such volume in that time frame. I just hope such attention could be given to some lowcaps with solid usecases and major contribution to the crypto space, I mean it will make sense to see ORE or NXRA doing a 10x atleast.', 2), (""We need more launches like that in order to say it. One successful launch doesn't mean much to me."", 1), (""I don't see that, maybe because I'm not focused on memecoins. I pay more attention to projects that are based on real fundamentals. I follow LSD landscape (LIDO Rocket Pool) and Oracle projects (DIA &amp; LINK)."", 1), (""I'd say memes make the cryptoverse look like a Ponzi scheme, and with the hype they receive which is short-lived, they are quick to give the next 10x but with high risks.\n\nBuying into fundamentals that offer innovative solutions to the core problems in the space is more of a long-term investment. Getting into crypto payments solutions and decentralized communication offerings like Sylo's wallet, staking opportunities like AVAX, and Derivatives: DYDX and GMX are worthwhile."", 1), ('[removed]', 1), (""It's an obvious pump and dump, almost everyone buying it is waiting to dump in the shortest time, this is why I'm always for other narratives like AI, DeFi or ID management because people will actually hodl long term because of the developments and future possibilities in those areas."", 1), ('[removed]', 1), ('[removed]', 1), (""Certainly, cryptocurrency is inherently volatile, and embracing risk is often integral to achieving success. While it's evident that we're currently in the midst of a meme-driven market, the question remains: how long will these trends persist? Personally, I tend to favor altcoins that possess a strong use case. As for my own investments, I've amassed a substantial quantity of ARB, SUI, FUND, MNI, and BRISE, as I believe that these particular projects hold great promise for the future."", 1), (""I think fomo kick in, but most of the tokens lack liquidity except those listed on exchanges like mexc and bitget. Perhaps it's time to start shorting them on mexc as well."", 1), (""It's difficult to determine, but I hope that things turn out well in the upcoming bull run."", 1), ('[removed]', 1), ('I am optimistic that the upcoming bull run will surpass all previous ones, and I anticipate that projects related to real-world assets (RWA) will likely gain the most traction. Currently, I am conducting thorough research on RWA projects. Additionally, I am also exploring the potential of non-fungible equity (NFE) as a promising area.', 1), (""We all have different interests in projects, which makes it fun. I just ensure that I don't hold more than I can afford to lose, and that's it."", 2), ('[removed]', 1), (""I totally agree. Investing in crypto has opened my mind to a lot of possibilities. It's important to find what works best for you. Personally, I'm drawn to projects that bridge the gap between tangible assets and the digital world, creating a seamless interaction and mutual support."", 1), ('[removed]', 1), ('[removed]', 1), ('[removed]', 1), ('[removed]', 1)]"
Someone lost $1M on PEPE token Phishing site,,123,28,2023-04-20 11:39:53,,SatoshiStreetBets,Trading loss porn 🤯,"[('How does one who has one mill loses it to a scam?', 20), ('You would think they should have the knowledge  not to get scammed', 4), ('If you got a milli to throw at a shitcoin named after a cock you ain’t hurting too much', 8), (""Good. Sounds like they would've been had eventually anyway."", 2), ('its not named after a cock its named after the frog pepe', 10), ('PEPE is going to pull a shib', 8), (""Scammers these days are really upping their game.\n\nAfter I saw mexc having a Kickstarter event for PEPE, I tried accessing their twitter handle but it was very hard because there were a lot of scam account for the same project, I even saw their announcement for an airdrop now imagine the hundreds of people that'll blindly write their address.\n\nIt's hard to spot the scam accounts but it gets easier with time."", 2), (""These type of rich are rich because they were born into, not because they're smart."", 15), ('Very easy. Too easy. So\nSad', 1), ('Can I buy pepe coin using metamask seapping for eth???', 2), ('I considered it in uniswap for a hot second but it was $38 in gas about half an hour ago. I don’t have enough FOMO to go higher than $100 usd worth so I’m just a spectator for now.', 4), ('I just said F*it and bought lol, $112', 3), ('Or got lucky and gambled into it with risky crypto or stock options. Easy come easy go as they say.', 9), ('It went up 10% since I invested 45 min ago😂😂😂', 1), ('while others are winning some are loosing due to fast clicks everywhere', 1), ('[removed]', 1), ('[removed]', 1), ('A ridiclous amount of money has been paid in previous bull runs… usually with highly risk adverse people', 1), ('penis frog', 2), ('Shows you the kind of people that have invested in PEPE I guess. 😭', 1), ('[removed]', 1), ('How does one gamble $1M into a ""pepe coin"" to begin with.', 1), ('Purposely misleading title, 460 people lost 1.35 million, not one person', 1), ('[removed]', 1), ('[removed]', 1), (""Er no, that's several people not just one"", 1), ('[removed]', 1), ('[removed]', 1)]"
"Happy 4/20! $Pepe is taking over the world and honestly, I think it’s only just begun. Thoughts?",,1,0,2023-04-21 01:47:46,,SatoshiStreetBets,Meme 😂,[]
pepitium | next pepe,[removed],1,1,2023-04-21 06:17:49,,SatoshiStreetBets,Meme 😂,"[('/u/Amarmaulana23, to prevent spam, your SatoshiStreetBets submission has been removed due to your **comment** karma being less than 200. Please remember **comment** karma is different than your total combined karma. You can learn more about the [different types of karma here](https://reddit.zendesk.com/hc/en-us/articles/204511829-What-is-karma-) You can build up comment karma by making quality comments across Reddit. If you have a questions, please feel free to send the SSB moderators a (nice) modmail.\n\n*I am a bot, and this action was performed automatically. Please [contact the moderators of this subreddit](/message/compose/?to=/r/SatoshiStreetBets) if you have any questions or concerns.*', 1)]"
Why do you hate PEPE Token?,"I have seen lot of discussion about pepe token, some say it is a scam while the others say it is a pump and dump even Sam of evergrow wrote a tweet about why he thinks Pepe token is a scam

https://twitter.com/EverGrowSam/status/1648808632614518788?s=20

Let's be real here, why do you hate pepe token, is it because you missed the train or because you really think it is a scam or pump and dump?",1,23,2023-04-21 10:30:21,,SatoshiStreetBets,Discussion 🦍,"[(""Because it's a useless meme token of a frog. Will probably make it to mainstream like other memes which is a dissapointment for crypto in general.\n\n![gif](giphy|idYdfZ9xxVgVPNXjs0|downsized)\n\nEventually people will get dumped on. Like all memetokens do. Probably by the early buyers that happen to be the 'devs' ![gif](emote|free_emotes_pack|facepalm) or friends."", 11), ('I dont like that fucking frog face 😁', 0), (""Because someone looked on chain and found that their was a ton of early buyers aka insiders before this started being pushed on social media and the  to us in retail\n\nPlease read this, if it doesn't change your mind I hope it saves someone's money.\n\nhttps://twitter.com/CryptoKoryo/status/1648979943764762626?t=GGfuqtOS49mKHqtzk9vodA&amp;s=19"", 0), (""Because 99% of new coins are scams, and the few that actually survive you don't find out about until it's too late and the founders and their friends make hundreds of millions."", 3), ('Noob question incoming: no major platform has Pepe or other similar meme coins listed in early Phase. How does one actually but these? Founders, I understand .. but when the retail, fomos .. how do they buy it?', 2), ('Because the hype now is to feed the big whales who cannot cash out their millions as there is not enough liquidity.\n\nBecause bag holders buying the top are acting like there is still room for x10 while they just want to break even and create new bag holders.\n\nIt’s the same old meme gamble.', 0), ('Obvs because who isnt salty they missed a stupid payday. \n\nIts more that its slimy as fuck people looking for exit liquidity who are still shilling it', 2), ('Defi, a de ce trained exchange and an eth wallet. Uniswap. Sushi swap one of those.', 2), ('Defi, a de ce trained exchange and an eth wallet. Uniswap. Sushi swap one of those.', 1), ('After the DOGe pump and dump nobody is ready to get shit on like that again I', 0), ('This has been proven wrong. Sorry', 1), ('Willing to look at any evidence \nHow or who proved it wrong?', 0), ('I will never do someone else’s research. Sorry. First tweets all that bs. Do your due diligence', 1), ('But I DID my own research.\nAnd I found it very valid so I linked it and shared it with you.\n\nIt\'s very telling that you say it\'s been completely debunked, don\'t say why then hit me with a ""DYOR, I refuse to do your research for you""\n\nWhat a laugh', 0), ('[removed]', 1), ('[removed]', 1), ('[removed]', 1), ('That’s not true, I’m deep into NfT Twitter and I heard about this coin the same Friday it was launched. I have no relation to any founder or dev, and actually bought in the 3 day because I wanted to see if it did good first. The official page of the coin was around way before launch day publicly posting too', 1), ('If they print money,  we do!', 1), ('https://i.redd.it/xehlyhcbaqva1.gif\n\n$BONK', 1), ('let them fucking burn their own money.', 1), ('[removed]', 1), ('[removed]', 1)]"
