title,selftext,score,num_comments,created_utc,url,subreddit,flair,comments
How and Why I came into Investing in $SSB (Previously known as Derpy) and #SatoshiSwap (Might take around 3 to 4 mins of your reading time).,"In late 2020, a friend  of my introduce me to the world of Cypto. It took me a few weeks of researching what was it all about and the various coins on the market. I made my 1st purchase in Doge on Feb 3rd 2021 at around $0.04 (FYI I miss my initial entry in Dec 2020 when prices were below 1 cent as I was still not comfortable in investing in Crypto)  and subsequently into Shiba Inu, Safemoon, ...etc. I have to be frank I was quite lucky in a sense that I got in early before the real pumps came in and overall made 10x what I put in after offsetting the losses in some shit coins and con jobs (using the 4 points written below). 

Along the way I refined the basis of of my entries after going into Wall Street Bets and subsequently by chance into Satoshi Street Bets. It was here that I came to set up my personal ""Crypto Investment Philosophy"" or ""CIP"" as I would like to call it 

1) Coins with real world utility or striving towards it;

2) Coins backed by Strong Communities (hardcore);

3)  A team of dedicated founders and developers; and 

4) Good trading volume

Along the way I notice a frequent person posting known as Little Eagle and little did I know that that person was actually David Gilbert the founder of this group until subsequently *(FYI I was scanning daily through this reddit group and a couple of others for coins meeting my 4 criteria)* so one day he mentioned that he wanted to come up with his own brand of Coins with some utility of a margin trading Dex so I decided to keep in view the developments. 

As the weeks pass by in 2021 and more details were released I come to a decision to invest into Derpy and Swap and did the Whitelisting and KYC and participated in Copper Launch *(FYI I did not sleep for almost 48 hours by checking the prices every 30 mins as I am very careful of where I put my money into, I even made a forecast of the price decay and it was almost 95% correct and happy to say I bought in at almost the bottom when the volume and prices started deviating from my forecast.).* The actual reasons for me to invest was due to the very stringent criteria needed to buy the coins and the reasoning David gave which was not like those pump and dump coins where whales swoop in and then sell, rekting the small fishes. I studied the entire whitelisting process, search on Diamond Hands Consulting Pte Ltd, the Law firm appointed, ...etc

And so the journey started, along the way certain elements of the Margin Trading Dex were altered and deadlines were pushed but it was all explained in a transparent fashion and boy did the evolution of the utility products evolved into a more sophisticated product then what was initially mentioned. Over the months the numbers of Wen Moon/ lambo boys came down and the telegram group was left with a group of dedicated investors. Its frankly very heartening to see David and the developers continuing to build over the crypto winter. The money gained during presale is still around and not rugged and you can check it in the blockchain yourselves. 

Around late 2022, David came and told us that he had won a lawsuit against the fake SSB coin. I took it up and started searching for whatever information that is publicly available and came across the court proceedings at the New York Circuit Court, the name of the Judge, the Trademark applications and the various jurisdictions the Trademark has been applied for.  This put me in a position where my trust in David and the team has risen up a few notches as you know litigations are not a small matter and to have the dedication to see it through and win makes it even more admirable especially is that it was won in America where there is a lot of bias towards crypto recently with operation chock point 2 in progress. I have to admit that I have been interested and invested in this project way before the 99% who came in recently and have seen the progress made over year. 

To those new investors, currently the progress of the Charting Platform is in its final Beta form and quite a number (more then 50 of them as far as I am aware) of the regulars at the SatoshiSwap telegram has been testing it although I do feel a tad disappointed not to have been one of them but hey thats life and you can't always be at pole position. As for the Dex as far as I know is that it has gone through 2 audits and is almost ready to be integrated with the Charting Platform. I read thoroughly through the 1st Audit Report and the minor issues found. 

Overall the final product is almost coming to fruition and the bull market is almost upon us, its like Crypto spring at the moment and the products and integration is almost on hand. You should really go read up at [https://ssbcoin.com/](https://ssbcoin.com/) and [https://satoshiswap.net/](https://satoshiswap.net/) for more information related to the 2 coins. 

***(Disclaimer: The above is NOT I repeat NOT financial advise and YOU SHOULD always DYOR before investing into any financial product not only in Crypto but others such as Stocks, Insurance, ETFs...etc).***",64,29,2023-05-26 10:03:27,,SatoshiStreetBets,Discussion 🦍,"[('You literally described my story. David &amp; SatoshiStreetbets showed me that you can invest in growing products on crypto without being milked as an Investor. Im feeling good about my investment since day 1\n\nThese guys are developing something great. Dyor fam.\n\nhttps://preview.redd.it/y16454ug172b1.jpeg?width=941&amp;format=pjpg&amp;auto=webp&amp;s=171037513093faacc86b41f4360001f458f5a9f0\n\n🐸🔥', 21), (""Your initiation into crypto is much like mine, i started at Wall Street Bets then Satoshi Street Bets... Doge, SWAP, Derpy/SSB (and a few others I'm ashamed to admit to)"", 16), ('Great post and very informative. Everyone should definitely have an investing philosophy and stick to it especially in crypto. Thanks  for sharing!', 13), ('100% agree! DEGENS GET READY! WE ARE HERE TO STAY 💎💎💎', 13), ('TLDR: Buy or FOMO', 6), ('https://preview.redd.it/3iykrm4si72b1.jpeg?width=692&amp;format=pjpg&amp;auto=webp&amp;s=7aa5ca79e391fc873ef3bca469247084a92eea9e\n\nSalut to that, my friend. The same reasons for me. The community, the project, the background (someone say „gamestop“) and david in person are absolutely parts, which made this decision for me an absolut no brainer.', 8), ('[removed]', 1), ('[removed]', 1), ('[removed]', 1), (""Both. Don't misss out on a good deal"", 7), ('If there is anyone who is asking questions on SSB or Swap you can link them here. Hopefully it helps to make them better understand.', 6), ('[removed]', 1), ('[removed]', 1), ('[removed]', 1), ('[removed]', -1), ('[removed]', 1), ('Same story almost for me as well! $SWAP $SSB all the way!', 5), ('[removed]', 1), ('I came in a little later but was still early enough to catch the copper launch. DCAed ever since and am now proud owner of a little bag. Even though I am slightly at loss at the moment I’m still super bullish for SatoshiSwap 🚀🚀🚀', 6), ('[removed]', 1), ('[removed]', 1), ('[removed]', 1), ('Your doing much more then me Bro, amazing work shilling all over the place and man the live talk show work is great!', 3), ('Once the products are out and we go into the bull market your Bag will be worth much more!', 2), (""Theres truth in what you have said and I do agree with your point to the extend of it relating to pure meme coins with basically no utility. Its akin to a pyramid scheme fleecing the ones who have newly bought while benefiting those who came in early at a cheaper price and sold at a significant profit. A game of chance in a giant casino. Man's greed are often the cause of their own dismise."", 1), (""Don't be ashame Bro, we learn from our mistakes"", 2), ('[removed]', 1), ('Amazing post bro', 3), ('Thank you very much ![gif](emote|free_emotes_pack|snoo) pls share with around, the more it goes around the more potential buys on SSB.', 1), ('Hello - This has been removed due to concerns it is violation of  [`Sub Rule #6: Be A Good Neighbor`](https://www.reddit.com/r/SatoshiStreetBets/wiki/contentguide#wiki_rule_6_.7C_be_a_.22good_neighbor.22)\n\nIf you have any questions, please feel free to message the mods via modmail.', 2), ('Try this , thank me later  https://youtu.be/G4SDB82Phdc', 1), ('Any updates?', 1), (""Liquidity was pulled. Rugged by David.\n\nLooks like it was used to buy a house:\n\n# DIAMOND HANDS CONSULTING LIMITED\n\nCompany number\xa0**15635168**\n\n**19 Lindsey Road, Bishop's Stortford, England, CM23 2TA**"", 1), ('Fuckin shit', 1)]"
The next bull run will be all about Pepe and Pepe inspired meme tokens,"It seems like there is some clue to what could be the number 1 meme token of the next bull market.  I believe PEPE the frog and all pepe inspired meme tokens will be where most of the profit will be made in the next bull market.

In the last bull market, Shiba inu and dogs inspired meme tokens were the talk of the town, many traders made lot of profit from Shiba and dog related meme tokens. 

Now is the time for pepe and every pepe ( frog) inspired meme token, pepe has already paved the way with its volume and marketcap, that already has sent a signal that there are lot of traders who believe in pepe, it is also  signaling that the next bull market will be all about frog meme tokens.

I confidently believe frogs will be the animal for the next bull run, let's see how it goes.",1,40,2023-06-01 12:27:28,,SatoshiStreetBets,Discussion 🦍,"[('#SSB $SSB going to explode !!!!!!!!!!!!!!💣💣💥💥💥💥💥💥💥💣🔥🔥🔥🔥🔥', 8), ('$SSB is the coin of the next billionaires. Buy our cry later. #SatoshiStreetBets SSBcoin.com', 10), ('🐧\nNoot', 4), ('$CONE  r/coneheads \nDon’t sleep on it \n\nCONE!', 0), ('$NOOT $NOOT', 2), ('Bitconnect vibes', 3), ('Imagine a token that unites us all, regardless of our backgrounds, our wallets, or our experience in the crypto space. $SSB does just that. It transcends the boundaries that often divide us, forging a bond based on shared values and the collective yearning for a better tomorrow. It has become a symbol of hope and resilience, reminding us that even during the most challenging times, we can find strength in unity.', 3), ('[removed]', 1), ('#SSB will explode soon', 6), ('$pepe', 2), ('Definitely the most potential meme coin I’ve ever seen', 1), ('Which frog is the best one to invest?', 1), ('[deleted]', 1), ('$SHEPE SHibaPEPE- the first one - 29 days old - i know for a fact the dev is friends with Shiba top guys js its all connected, Crypto Messiah is a mod in the tg lol but they arent pushing it rn - sitting at 150k mc', 1), ('[removed]', 1), ('#KermitTheCoin', 0), ('$noot', 0), ('I still believe that the major AI tokens are going to skyrocket. My moonshots right now are Fetch.ai and AGIX. \n\nAlso of course I own some $SSB', -1), ('[removed]', 1), ('[removed]', -1), (""I think the memecoins hype is over. But who knows, everything can change, this space is unpredictable.\n\nI am firmly convinced that solid projects like those that are being built during the bear market will do well. My hopes are high for LINK DOT DIA UTK and OCEAN. Let's see how it plays out."", 1), ('This is not true. The bull run truly will have effect on memes but it will be more impactful on utility driven project like CYMI that is working on crypto payment adoption.', -1), ('Where can i buy ssb?', 2), ('Uniswap or BKEX', 4), ('$Archa', -1), (""If you like ai projects you should check out ALi\nFet and ali seem to be the only two projects that actually integrate ai in a meaningful way besides data interpretation \n\nAlthough I haven't looked into agix \n\nAli is like half ai half blockchain gaming/metaverse\nWhich I know metaverse is slumping rn but Ali is about the only thing that sounds like it would make it interesting"", 0), ('[removed]', 1), (""Meme have their role to play, but I think investors are moving back to sustainable utilities. Wouldn't hurt to hold some memes just in case. Also wise to look at what the next real thing is, like health care on blockchain for instance. ImmunifyLife is one of those giving back to people when they share their health data anonymously. Makes for faster prescription and the correct diagnosis reaching those in still developing countries."", 1), ('The memecoin season is gradually fading out, I dont see the bullrun being centered on any memecoin.  There are a good number narrative that can start a bullrun in the cryptospace, Decentralized identity, privacy and Web3 are just few of such narratives.', 1), ('Hey hey hey !', 1), ('Definitely $SSB / #SSBCoin\nThat is the next Froggie in da house 😎', 3), (""&gt; Although I haven't looked into agix\n\nAGIX's main thing is their AI Marketplace where you can pay a small amount of agix for AI services. They have some cool stuff on there I've used the platform a few times myself.\n\nNot trying to sound like a shill here, DYOR and all that."", 1), ('[removed]', 1), ('[removed]', 1), ('$croogebsc just look at it will ya', 1), (""There is no doubt about AI base project. I'm also holding these prior to the mini pump. Another aspect I feel has what it takes to emerge, considering the speculation, sentiment, and narrative, is RWA. I'm rooting for MNIcorp, Realionetwork, and EKTA in this light. Quick question: is ssb a meme coin?"", 1), ('Delusional. RIP to your money', 1), ('[removed]', 1), ('You should check out $RFD token. We thought it was a meme, but found out it’s for freedom!', 1), ('[removed]', 1), ('[removed]', 1), (""Invariably you've not done research on $RFD before investing. As the RefundCoin token continues to exhibit impressive growth, it is evident that early investors have reaped substantial rewards. Another aspect I think will yield rewards is the RWA tokenization. I think MNICORP,  Securitize, and Polymath are the most robust business model for asset tokenization as they leverage on RWA."", 1), ('This time meme project are doing really good thing , BUT recently i have invested on a strong project , that is #PRI . Privateum Global Co-Op provides a platform to manage various digital assets such as cryptocurrencies, tokens, and stablecoins . check out privateumglobal', 1)]"
Shiba URGENT!!!,[removed],47,33,2023-06-01 23:28:29,,SatoshiStreetBets,News 📰,"[('U BEST!!!', -6), ('[removed]', 1), ('[removed]', 1), ('[removed]', 1), ('[removed]', 1), ('[removed]', 1), ('[removed]', 1), ('[removed]', -5), ('thanks', -4), ('[removed]', 1), ('[removed]', 1), ('[removed]', 1), ('shiba best', -3), ('now i am in a good mood', -3), ('now i am in a good mood', -3), ('[removed]', 1), ('thanks', -4), ('[removed]', 1), ('[removed]', 1), ('[removed]', 1), ('[removed]', 1), ('[removed]', 1), (""Oh it's fake. Had me for a minute though"", 13), ('[removed]', 1), ('[removed]', 1), ('Lol fake fake', 6), ('[removed]', 1), ('Do mods not exist for this page?', 6), ('Nope', 2), ('Fake , I literally follow the real account and can’t find that tweet. Do not believe this bull', 1), ('It’s fake, make a Twitter and follow the official accounts if you’re gonna invest , it’s the least you can do', 1), ('Take participate…. Just buy $25 google gift card for airplane gas fees to make droppings in you', 1), ('go now to this fake metamask site and enter your seedphrase to get the airdrop', 1), ('[removed]', 1)]"
Shiba URGENT!!!,[deleted],21,1,2023-06-02 13:56:52,,SatoshiStreetBets,News 📰,"[('[removed]', 1)]"
