title,selftext,score,num_comments,created_utc,url,subreddit,flair,comments
The most degen of Crypto Twitter traders seem to be moving past Shiba Inu-fashioned tokens to those branded after the internet meme Pepe the Frog.,,33,20,2023-04-18 21:07:26,,SatoshiStreetBets,News 📰,"[('[deleted]', 1), ('Some early PEPE users have turned a few hundred dollars to six figures on the latest meme obsession.\n\nThe token launched Sunday ran over 21,000% in the past three days, raking in $30 million in trading volumes on Uniswap and reaching a market capitalization of as high as $33 million on Tuesday morning.\n\n“The most memeable memecoin in existence. The dogs have had their day, it’s time for Pepe to take reign,” the Pepe website says.\n\nThe tokens have no connection to the actual Pepe the Frog meme or Matt Furie, the meme’s original creator.\n\nWe’ve got what you want to know about the latest meme token craze at the link in bio.', 1), ('[deleted]', 1), ('Some early PEPE users have turned a few hundred dollars to six figures on the latest meme obsession.\n\nThe token launched Sunday ran over 21,000% in the past three days, raking in $30 million in trading volumes on Uniswap and reaching a market capitalization of as high as $33 million on Tuesday morning.\n\n“The most memeable memecoin in existence. The dogs have had their day, it’s time for Pepe to take reign,” the Pepe website says.\n\nThe tokens have no connection to the actual Pepe the Frog meme or Matt Furie, the meme’s original creator.\n\nhttps://www.coindesk.com/markets/2023/04/18/pepe-the-frog-memecoins-rocket-as-crypto-twitter-moves-over-doge-obsession/', 1), ('\nThe most degen of Crypto Twitter traders seem to be moving past Shiba Inu-fashioned tokens to those branded after the internet meme Pepe the Frog.\n\nSome early PEPE users have turned a few hundred dollars to six figures on the latest meme obsession.\n\nThe token launched Sunday ran over 21,000% in the past three days, raking in $30 million in trading volumes on Uniswap and reaching a market capitalization of as high as $33 million on Tuesday morning.\n\nThe tokens have no connection to the actual Pepe the Frog meme or Matt Furie, the meme’s original creator. \n\nhttps://www.coindesk.com/markets/2023/04/18/pepe-the-frog-memecoins-rocket-as-crypto-twitter-moves-over-doge-obsession/', -1), ('[removed]', 1), ('Nah, tamadoge about to be up over 200%, still undiscovered and about to be listed on a top 5 exchange', -5), ('$hitcoin season boys and girls!', 1), ('The battle of memecoins. dog vs pepe', 1), ('[removed]', 1), ('[removed]', 1), ('What the actual fuck? Seriously, is this an intentional attempt to ruin crypto further?', 1), ('What the actual fuck? Seriously, is this an intentional attempt to ruin crypto further?', 1), ('Not good in trading but Shiba Inu will produce millionaires in the future if the platform last longer', -3), ('There are still a lot of degens in the market, so this is not a big surprise. Maybe this will start the new meme season. What do you think?', 2), ('What about floki and bad mitten Asia 2023?', 1), ('Hey does anyone know the toke quote? Imma buy a few dollars just to be on the safe side', 1), ('Lol dream on', 3), ('[removed]', 1), ('[removed]', 1), ('[removed]', 1), ('[removed]', 1), (""Memecoins are still in existence, and this narrative may not end anytime soon, but I still favor the one that has real-world applications, like as MNI Corp's tokenization of tangible assets so that users can access them on a more liquid and safe platform. I only bite memecoins for short term but the chance is less."", 1), ('[removed]', 1), ('https://preview.redd.it/tkoohptiqfva1.jpeg?width=815&amp;format=pjpg&amp;auto=webp&amp;s=3c83fb53487479d4fcd6a16ff65298cb0197c01a', 2)]"
Are we in the Memecoin Bull season?,"Many memecoin are pumping, the notable one of them was pepe which might have launched 5 days ago, now has a marketcap of $142M ,volume of $152M and more than 29k holders.

Infact, there is a post of someone who made $1m after investing $25 in pepe, this made me remember the bull run season of 2021 where some early buyers of shiba and safemoon made huge sum of money by investing $200.

The success of pepe token has also lead to imitations and pump of various meme tokens like $mpepe, $chad and others.

I just wanna know, are we in the memecoin bull season  considering the fact that many memecoin has risen in value or alk these token  are just pump and dump?",18,55,2023-04-20 11:19:13,,SatoshiStreetBets,Discussion 🦍,"[('Yep and Tama following right behind with about about 1/6th of that market cap', 0), ('Banano still flat though', 3), ('Banano still flat though', 1), (""Tama hasn't pump since after presales"", 0), ('Looks like you’re a bit behind the times…check the charts now my guy it’s about to get listed on a tier 1 exchange', 0), ('[removed]', 1), ('i bought during presales and the price has fallen far below listing price.', 0), ('As a wizard once taught me, learn to hold', 0), ('not on a memecoin', 2), ('[removed]', 1), ('Where do you see that increase? When I check online on coingeko or others I only see a 400% increase and to go from 25 to 1M you would need a 4000000% increase', 3), ('No.', 1), ('We sure are - Satoshiswap one of the best opportunities out there.  Definitely look into and buy a bag', 2), ('Awww was about to check v_v 🍌the biggest benis of them all', 3), ('It’s called retail FOMO season.', 3), (""No, we are in a bull market for legitimate projects, but people still invest in memecoins as a quick way to make money. To invest in the right projects, you need to know about them before they launch. I might try some memecoins, but I'm also looking at long-term investments like LINK, DIA, ARB, and others. No matter what you invest in, it takes time to see results."", 0), ('[removed]', 1), ('Fuck no, not even close. Half the people in pepe have to wait to sell because there is fuck all for liquidity. Pepe just did well with marketing. Lots of coins do that every month and then crash and burn. Remember bonk?', 6), ('Fuck no', 2), ('https://preview.redd.it/57rra39ul4va1.jpeg?width=1080&amp;format=pjpg&amp;auto=webp&amp;s=173fe3fb0fe81a8ded9b919919862bf69f46be8a', 2), ('[removed]', 1), ('Quick way to lose money you mean', 1), ('DERPY next', 3), ('F*ck yeah we are. Meme coins are 24/7 and defy financial gravity. 420 #babydogeceo #dogeceo #frogceo', 0), ('[removed]', 1), (""We might be. Memes are good when you catch them early and also exit when you should. Good to make quick profits but never for long term. I do gamble from time to time but I still have long term tokens I hold (BTC, ETH, ARB) etc and I pay attention to trends too. RWA tokenisation seems to be the current one and MNICorp is one of those implementing it, and on defi. I'm still navigating the waters on that."", 1), ('You are right. PEPE and AIDOGE did really well. I just hope the main bull run begins. It will be massive as most projects are rolling out new developments. NXRA and AUDIO have been keeping up with the trend.', 1), ('[removed]', 1), ('[removed]', 1), ('[removed]', 1), ('[removed]', 1), (""CG and CMC  dont track from launch.  That's why you dont see the insane increase"", 1), (""Pepe listed on 3 cex's almost right away.  That's not cheap to do. It may have been a fair launch...but loads of cash behind those projects"", 1), ('Be sure to do thorough research because they  comes with risks, as most of them are swiftly replaced by a new trend. This is why my portfolio is only 5% memes, and the rest filled with solid alts with real-world use cases like Ethereum, Bmi, Monero, and Sylo, to name a few.', 1), ('[removed]', 1), ('It launched at a 1k mcap as I heard. I personally saw it at $2.5M mcap &amp; ignored it.', 1), (""Well, I don't expect to see the next SHIB until the next bull. But maybe we are in their season already, not sure.\n\nFundamentals always win in the end, so I would still be exposed to ETH, MATIC &amp; upcoming tokens on my watchlist; ADE &amp; PEG."", 1), (""The market is volatile, you can make or lose money. It's part of the game."", 1), ('Yeah. I know mine is less than 5%. hahaha', 1), (""When it comes to fundamentals, I keen to those with widely adopted solution in reality like that of the crypto payment solution with thousands of merchants integrating the innovative technology into their platforms for their consumer's daily usage and not some upcoming watchlist that might fail to fulfill their promises."", 1), (""Not seeing any sign for that, though I've thrown some money I can afford to lose on it, atm my main focus is getting more Metaverse tokens, especially those ones with an active ecosystem like RIDE for holoride, RoboEra, and a few others."", 1), (""Memecoins will remain always be PNDs besides there's no bull season anywhere just yet. I believe fundamentals will thrive more in the next bull season as more people are focused on important topics such as privacy, identity solutions and AI."", 1), ('I agree, its takes a lot of money to get such volume in that time frame. I just hope such attention could be given to some lowcaps with solid usecases and major contribution to the crypto space, I mean it will make sense to see ORE or NXRA doing a 10x atleast.', 2), (""We need more launches like that in order to say it. One successful launch doesn't mean much to me."", 1), (""I don't see that, maybe because I'm not focused on memecoins. I pay more attention to projects that are based on real fundamentals. I follow LSD landscape (LIDO Rocket Pool) and Oracle projects (DIA &amp; LINK)."", 1), (""I'd say memes make the cryptoverse look like a Ponzi scheme, and with the hype they receive which is short-lived, they are quick to give the next 10x but with high risks.\n\nBuying into fundamentals that offer innovative solutions to the core problems in the space is more of a long-term investment. Getting into crypto payments solutions and decentralized communication offerings like Sylo's wallet, staking opportunities like AVAX, and Derivatives: DYDX and GMX are worthwhile."", 1), ('[removed]', 1), (""It's an obvious pump and dump, almost everyone buying it is waiting to dump in the shortest time, this is why I'm always for other narratives like AI, DeFi or ID management because people will actually hodl long term because of the developments and future possibilities in those areas."", 1), ('[removed]', 1), ('[removed]', 1), (""Certainly, cryptocurrency is inherently volatile, and embracing risk is often integral to achieving success. While it's evident that we're currently in the midst of a meme-driven market, the question remains: how long will these trends persist? Personally, I tend to favor altcoins that possess a strong use case. As for my own investments, I've amassed a substantial quantity of ARB, SUI, FUND, MNI, and BRISE, as I believe that these particular projects hold great promise for the future."", 1), (""I think fomo kick in, but most of the tokens lack liquidity except those listed on exchanges like mexc and bitget. Perhaps it's time to start shorting them on mexc as well."", 1), (""It's difficult to determine, but I hope that things turn out well in the upcoming bull run."", 1), ('[removed]', 1), ('I am optimistic that the upcoming bull run will surpass all previous ones, and I anticipate that projects related to real-world assets (RWA) will likely gain the most traction. Currently, I am conducting thorough research on RWA projects. Additionally, I am also exploring the potential of non-fungible equity (NFE) as a promising area.', 1), (""We all have different interests in projects, which makes it fun. I just ensure that I don't hold more than I can afford to lose, and that's it."", 2), ('[removed]', 1), (""I totally agree. Investing in crypto has opened my mind to a lot of possibilities. It's important to find what works best for you. Personally, I'm drawn to projects that bridge the gap between tangible assets and the digital world, creating a seamless interaction and mutual support."", 1), ('[removed]', 1), ('[removed]', 1), ('[removed]', 1), ('[removed]', 1)]"
Why are cat meme coins not a thing?,"We have literally had successful dogs meme coins like shiba and doge, and these memecoins are still in the top 100 cyotocurrencies on Coinmarketcap.

Recently we had the frog meme coins craze. They might over take the dog meme coins, but who knows, you know they say everything is possible in crypto.

Since the craze for dog and frog memet coins have been in demand, why is there no cat memecoin craze, 

After dogs, cats are the next in line in popularity of pets   most people own, someone would have expected that cat memecoins will be a thing but they aren't a thing.

Why are cat memecoins not successful like the dog memecoins?",18,44,2023-04-28 15:58:17,,SatoshiStreetBets,Discussion 🦍,"[('They are. I made a few K on a few last year or so.', 1), ('dog people &gt; cat people', -7), ('Taco Dog!', 1), ('[removed]', 1), ('Bingus token.', 5), ('I thought the same exact thing so I searched  and found Cate coin.\n\nThrew $100 at it. Gained a few % but It hasn’t really done anything.\n\nI really only got it because it’s a cat themed coin and for that I can’t really fault it\n\nhttps://preview.redd.it/0jvdk0lmmpwa1.jpeg?width=200&amp;format=pjpg&amp;auto=webp&amp;s=982fdbef686fb0e39a294def1cf576aef68e3995', 3), ('[removed]', 1), ('I got some cate too. \n\nI love cats and dogs equally. But one could say Dogs are flakey . I can get any dog to come to me with pepperoni … \n\nCats ? no way', 1), ('Because like a typical dog owner, they flaunt their holier than everyone attitude . So of course dog coins are the best. Duh', -3), (""There's Vancat, it's basically free now"", 1), ('Because Elon doesn´t have one', 1), ('Big eyes is a cat based coin in presale which ends June 3rd and launches on exchanges June 15th.', 2), ('Catcoin.io', 1), ('Cate made x100 last bullrun November 2021. I wouldn’t say thats not a thing', 4), ('If one cat coin has a chance to step into the footsteps of Shiba, Babydoge, or Tsuka, its gonna be KittyDinger.\n\nThey have the meme power (named after Elon Musks cat ""Schrödinger""). Its the nr. 1 search result on coingecko when you search for ""Schrödinger"". \n\nBesides that, they have a marketing deal with 9GAG, and, the most important thing, theres real utility behind the project, with KittUp multichain wallet, a 3D Metaverse game, and an incubator platform (launchpad), where stakers of KittyDinger receive free airdrops of new high quality projects like VetMe. In their first airdrop, one staker from the community received over $15k worth of VetMe coins. \n\nMore infos on their website: theschrodinger.com', 0), ('Now defunct.', 3), (""CCC Ceiling Cat Coin just dropped and has a rather high value considering it's brand new.\n\nPotentially a grower - high difficulty, high rewards. Plus the fact it is Ceiling Cat, which has its own mountain of memes."", 1), ('I’m buying', 1), ('I would expect any cat token to simply push the LP off the edge.\n\n![gif](giphy|uXbXCQ9c3irpC|downsized)', 2), ('Ociswap on radix will be massive', 2), (""I've wondered the same thing.\n\n I've bought cate, catpay, and catcoin and currently hold a little of all 3. \n\ncate and catpay are by the same team, the devs have created a wallet, an NFT game (Rise of Cats) which they are generally good at updating with new features on a monthly basis, and you would think they would be more popular than they are because they have some real use case. the game is actually fun even though the decreases in rewards has made most players abandon the game recently. Worse though is that their marketing sucks, the team does nothing in this regard, and they also ban people in the telegram all the time for simply making suggestions. I still have hopes for catpay though, since it is relatively unknown and has very low mcap and still has a chance imo, maybe.\n\n[catcoin.com](https://catcoin.com) also has a chance if the presale people stop dumping their tokens. it was launched a few months ago, and also low mcap around 180k. it also has a share to earn feature for posting crypto news articles. The branding and marketing efforts are a little better by this team, but still not up to the level of other meme coin teams.  \n\nif none of these cat tokens take off, I'm done with cat tokens for good though, it may just be that cat people are not good investors overall."", 1), ('[removed]', 1), ('Sirius-ly?  Heaven is the dog star.', 1), (""Cat memes in general don't seem very popular."", 0), ('JUst PnD', 1), ('So you mean buy?!', 2), (""Ha, doesn't surprise me."", 2), ('Catgirl.io', 1), ('[removed]', 1), ('Because nobody like cats same way like dogs', 0), ('[removed]', 1), ('Ther', 1), ('There was a catcoin before. It pumped like hell.', 1), ('Because go fuck yourself', 0), (""Early 2014 the world had KittehCoin (inspired by doge)\n\nNot surprisingly, it didn't survive. Surprisingly, doge did tho"", 1), (""Soon there's big eyes token coming for cat"", 1), ('[removed]', 1), ('[removed]', 1), ('[removed]', 1), (""Timing: Dog meme coins like Dogecoin and Shiba Inu Coin gained popularity at a time when the crypto market was experiencing a lot of hype and attention. It's possible that cat meme coins simply haven't had the same level of exposure at the right time."", 2), ('[removed]', 1), ('[removed]', 1), (""I think Cat memes need a catalyst for people to see its potential like what did Elon do to Doge. Doge and PEPE is way more popular meme even before crypto gets hype. Cat is not much, we don't see any hype about cats if there is, its only a few days or week that people will keep talking about it but soon died down. You will see doge on an everyday meme but cat? Not much. However, I still think that it will have its spotlight soon on crypto. A catalyst is all we need."", 1), ('[removed]', 1)]"
"Did you miss SHIBA INU? Don't miss $PSHIB an adorable unique hybrid of Shiba Inu and Pony. Pony Shiba Inu is the hottest new meme coin in town! This adorable little pooch is taking the crypto world by storm with its cuteness and quirky personality. With a face like that, who wouldn't want to invest?",[removed],1,2,2023-05-02 04:17:17,,SatoshiStreetBets,Elon Musk,"[('/u/NoisilyFrightened, to prevent spam, your SatoshiStreetBets submission has been removed due to your **comment** karma being less than 200. Please remember **comment** karma is different than your total combined karma. You can learn more about the [different types of karma here](https://reddit.zendesk.com/hc/en-us/articles/204511829-What-is-karma-) You can build up comment karma by making quality comments across Reddit. If you have a questions, please feel free to send the SSB moderators a (nice) modmail.\n\n*I am a bot, and this action was performed automatically. Please [contact the moderators of this subreddit](/message/compose/?to=/r/SatoshiStreetBets) if you have any questions or concerns.*', 1), (""We're removing your post under [`Sub Rule #1`](https://www.reddit.com/r/SatoshiStreetBets/wiki/contentguide#wiki_rule_1_.7C_project_listing_thresholds). While this project may be tracked, it is still a few days too young to be on SSB. The **minimum project age is 7d**, and this is the uncommon project to obtain a tracked listing in such a short amount of time.\n\nWhy don't you discuss it over at r/satoshistreetdegens for a few more days?\n\nThanks for understanding, and questions may be directed [to modmail.](https://www.reddit.com/r/SatoshiStreetBets/wiki/contentguide#wiki_about_modmail)"", 1)]"
