title,selftext,score,num_comments,created_utc,url,subreddit,flair,comments
"Unpopular opinion: If you are invested in a token with less than 100k in liquidity, you better sell","Do you realise that no token founded in 2020,2021 or even before 2020 whether utility or meme token have been able to break their ath since 2021.

Go to coingecko, type in your favorite token, you will realise that most of your favorite tokens haven't been able to break their ath, you can check shiba, safemoon, dogecoin, none have come close to their ath, since 2 years ago.

Now, there are many low cap tokens with very low liquidity, some of you are holding them, some has utility while some do not have, what are the chances that they will pump in the next bull market or users will use their utility?

Crypto marketing has become very expensive, you got influencers charging ridiculous fees for a tweet, marketing on social media platforms are also expensive. 

imagine a token with 20k liquidity, or 40k liquidity, what is the chances that it will pump in the next bull market? how many tokens can the team sell to create a marketing budget that can attract new buyers to pump the price up or use its utility especially with the 0% tax used nowadays to attract new investors.

Just because the token you hold with your dear life is 2 or 3 years old does not mean it will pump in a bull market even if it has an utility. Only projects with good liquidity and good budget for marketing will pump in the next bull market.

The truth is that many founders of low liquidity projects of 2020 and 2021 are already thinking of starting new projects in the next bull market.

If i was you, i would sell all my low liquidity tokens at loss or forget about them and prepare for the next bull market.",20,46,2023-06-19 09:50:22,,SatoshiStreetBets,Discussion 🦍,"[('What a stupid post. Yeah no shit Sherlock. They didn’t brake the last bull ATH now that we are in a bear', 14), ('😂😂😂😂😂😂', 3), ('Tldr Buy high sell low.\n\nThanks, great advice.', 23), ('I have exactly 1 dogecoin purchased at 27¢.\nThen Elon hosted SNL and the price tanked to 6¢, where it basically has remained. I’m guessing dogecoin will never get back to 27¢ or higher, but filing taxes for the 6¢ to too much of a hassle to sell it now.', 0), ('[removed]', 1), ('[deleted]', 1), (""While I respect your viewpoint, relying solely on this one factor may not lead to accurate conclusions. I've been involved in crypto for a considerable period, experiencing both substantial gains and losses. Due to a recent loss in the Atomic wallet hack, I transferred my funds to TrustWallet and MetaMask for increased security. At the same time, I'm closely following BrillionFi's progress in creating smart wallet and identity solutions with the NexeraID protocol. There's a chance I might move some of my funds there in the future."", 1), ('Dogecoin is a different game altogether.\n\nIt has a great community, it has elon supports, it has lot of liquidity, the chance of dogecoin breaking it ath is high', -2), ('Since you wrote that it is a stupid post tell me why? Or maybe you actually do have comprehension issues.\n\nIf you think it is a stupid post, go do your research on all the low liquidity tokens that launched before 2021 bull market, presently, they are all dead. The devs of these projects have moved on. I could even create a list for you.\n\nWhen the bull market comes, low liquidity project wont still break their ath, it is either they will be dead or be rugged.\n\nI', -9), ('Lol', 5), ('[removed]', 1), ('Watch out if you think everyone is stupid, most likely outcome is you are the stupid one!', 1), ('Liquidity is the most important factor, even if the price pumps you won’t be able to sell your tokens.', 3), (""Honestly, man, selling them when they are worth nothing is probably the last thing you want to do. We know that crypto life is almost like gambling. I feel like you are just like the guy that bought pizzas with his BTC.\n\nSelling my tokens now will not make me any richer, in fact, I can't do much with that money, so I might as well leave it there just in case, by virtue of a miracle, one of them pulls through. That would be enough for me... All it takes is for one of them to pull through (and they may never, but who is to say?)  \n\n\nI learned my lesson when I sold Doge coin (after holding them for nearly 4 years)... A couple of months later, what I sold would have paid for my house... and I walked away with 6-700 bucks... I was an idiot. That money did not even have a purpose... So, I strongly disagree with what you just talked about."", 8), ('I was like you before the 2021 bullmarket, i bought tokens with low liquidity thinking they are the next bitcoin because they all claim they were building the next big thing, looking back at them, all of these tokens are dead.\n\nYou gave an example of dogecoin, dogecoin had a great history and community, the idea of dogecoin was to mock btc, infact it has its own blockchain and it was a copy and paste btc code with a doge in it, that is one reason it was successful.\n\nBefore dogecoin became mainstream, lot of influential people in the crypto space were mining dogecoin, so it was primed for success.\n\nSo trying to compare your low liquidity altcoin with dogecoin or btc is silly.\n\nMost low liquidity altcoin will die off, it is just that.', -4), ('[removed]', 1), (""Whenever someone argues that you shouldn't buy alts because they won't hit ATH again. I walk away, because you don't need a new ATH to make profit."", 3), ('I agree that the comparison may be a bit stretched, but again, it is hard to know. I once bought ElonGate when MC was 3mil. That MC went all way to 700mil. The little investment I did there multiplied by a lot. I sold a portion of it and the rest is history. It is as dead as it can be. Don’t think it will resurrect. The point is, what good will it  do to me to cash 2-300$? You might as well leave it there.', 1), ('Yes', 1), (""You have a valid point here and holding alts are not the only way to make profits. So far, I've been exploring staking options and went in on the opportunity to earn above 10% on alts like Near, Mni, and Cap for passive income."", 1), ('I’m pretty sure I told you exactly why my G. Your opening statement is stupid AF. Saying tokens haven’t broken their ATH. An ATH that was achieved in a bull market while we are currently on a hard bear. What did you expect? Welcome to crypto. He have ATH once every 4-5 years and that a big if and then prices plummet to most by 90%', 4), ('I am not your G mr,\n\nIt is obvious you have comprehension issues.\n\nThe opening statement was just literally talking about the realities of the market. i guess it was so hard for you to understand', -5), ('Sure baddy sure', 2), ('Basically youre asking people to sell their shitcoins', 1), (""I didn't write you shouldn't buy alts, i wrote that dont buy alts with low liquidity"", 1), ('You know Elongate was founded on march 25th 2021 during the start of the bull market, so they had the right timing for the project to get to a MC of 700M, now the dev must have moved on.\n\nThat will be my strategy, wait for the bull market and invest in new altcoins and memecoins. Sell when people are buying at the top.', 1), ('Bahahahah I knew you were just making a troll post. God damn, I almost thought you were serious until I read this.', 1), ('Fair enough.', 1), ('It obvious you dont understand the history of dogecoin before it became mainstream.\n\nDogecoin had a very strong community before it became mainstream, it was created to make fun of bitcoin, and was the first memecoin back in 2013, btw the codes of dogecoin are btc codes.\n\nDogecoin was free to mine and many people mined and got it for free. Many whales of doge got it for free.\n\nElon, mark cuban and co were secret supporters of doge before they took it mainstream.', 0), ('Only my shitcoin bag has tokens below 100k. My main bag is higher than that. CYMI and since it has been endorsed in UAE, I think it will be massive. I also have ID and ACOIN.', 1), ('Cone?', 1), ('Lol I had a few tokens I got during \nThe ICO era bull RN  that disappeared and were delisted before the last bull run happened. So there is some\nTruth to what OP is saying.', 2), ('Holy shit it is almost like there is a bear market or something.', 3), ('IDOs are the way at the moment. Identify IDOs with solid ecosystems offering real world solutions and stand in line to get in when its fully launched.\n\nCurrently, I\'m keeping an eye out for a Polygon IDO that promises ""saving lives to earn"" feature, where patients control their health data and incentivises it by sharing data with health institutions of their choosing.', 1), ('[removed]', 1), ('This advise makes sense if you consider the rate at which these factors have come together to show its reoccurrence over time.\n\nYou need to understand cryptocurrency to buy cryptocurrency. You can do your own research and starting with AstraDAO, it is a nice option, because its innovative model creates a win-win incentive for profitable indices investors and token holders alike.\n\nBut always remember to research.', 1), ('[removed]', 1), ('The tokens below have now been delisted by MEXC because  they had little or low liquidity or traders stop trading them entirely. Some of this tokens were the darlings of 2021 bull market.\n\n\n""MEXC has delisted and ceased trading for the following tokens:\n\nTOWER, PWAR, BEYONDPROTOCOL, COOK, GFX, JT, MTA, PRARE, CHAIN, POT, DEFIT, VDR, ALPA, SUNNY, VVS, KINT, STEP, LAYER, GLO, XYO, SUTER""\n\nFor example, Beyond protocol  got to an ath of $61.79 on October 05 2021, now it is trading at 0.00046 and now has a volume of 6k.\n\nWhen the bull market comes, it wont break ath.\n\nSmart traders have sold at the top and move on. Holders are selling at a loss.', 2), (""Do I really understand you? You mean that if liquidity is low and people continually buy, it won't increase liquidity? Are you saying that liquidity is static even with high demand?"", 2), ('[removed]', 1), (""Yeah, I concur! That's why I'm participating in DUA/NXERA joint liquidity mining campaign on DeFi Terminal with up to US$ 300k in rewards."", 2), ('XYO has a large community of people building rewards by driving. The push they had was unprecedented and it was not favourable for actual XYO users and hodlers. Mostly people who drive for a living use it to gain free stuff.\n\nVVS I would not discount either just because MEXC delisted it. Crypto.com has been doing a steady job keeping up with regulators in various countries. They also have a feature to give users peace of mind with the idea their money is actually backed.  Crypto.com is popular amongst non hardcore crypto enthusiast. VVS is to Cronos chain as pancake swap was to Binance smart chain. I think Cronos currently has the best shot at replicating Binance level success after the next halvening.\n\nThe rest on that list... I do not know of any benefit or future benefit.', 1), ('It is an important conversation for people in the crypto space to have.  We are all so spread out amongst what coins we prefer. There should be a point where conversations about what is viable and what is not viable is accepted. \n\nThanks for starting this conversation', 1), ('Sell your shit coins at a loss. Report the loss when you file taxes. Then re-buy those same shit coins after the dropped in value by at least 10% from when you sold.  Of they do not pump at least you beat the tax man. If they pump your gains will be higher than it would have from just holding.', 1), ('[removed]', 1), (""Fair enough, did that too, and focused on good gems though atm all I'm doing is staking and trading because of the good trading calls I'm getting from Token Metrics, would resume my DCA on a few alt. in the next quarter."", 1), (""The bull run affect every token. Nothing is spared unless liquidity has been removed. Nevertheless, I get the point you're driving but I'm still holding my CYMI, VRA and HBAR. No giving up."", 1)]"
Shiba Inu Price Prediction: Will SHIB Sustain For Rebound?,[removed],1,1,2023-06-20 11:35:52,,SatoshiStreetBets,News 📰,"[('/u/Careless-Strike-4149, to prevent spam, your SatoshiStreetBets submission has been removed due to your **comment** karma being less than 200. Please remember **comment** karma is different than your total combined karma. You can learn more about the [different types of karma here](https://reddit.zendesk.com/hc/en-us/articles/204511829-What-is-karma-) You can build up comment karma by making quality comments across Reddit. If you have a questions, please feel free to send the SSB moderators a (nice) modmail.\n\n*I am a bot, and this action was performed automatically. Please [contact the moderators of this subreddit](/message/compose/?to=/r/SatoshiStreetBets) if you have any questions or concerns.*', 1)]"
ICP: The greatest disaster of 2021 bull run,"Internet computer (ICP) was the poster boy of the 2021 bull run, it was launched by a swiss non profit organisation called Dfinity in the start of the bull market,the founder Dominic Williams was called by the world economic forum, the next king of the blockchain, it got lot of support from VC firms, they raised about $166 million from Andreessen Horowitz and Polychain Capital.

During that period Shiba and co were also trending, but ICP was the most successful utility project, ICP got lot of free coverage because lot of people believed in it, it was the darling of 4 chan forum, they told everyone they could tell that ICP will displaced Ethereum. 

Exchanges were lining up to list ICP, On May 10, 2021, it got to an ATH of  $700.65, the coverage was massive, marketcap was worth $100 billion, ICP was going to disrupt cloud computing giants like AWS and Google Cloud.it was heaven on earth, those who bought early, couldnt believe their eyes, they were paper millionaires.

One morning, rumours started spreading that DFINITY the founders of ICP, has dumped billions of dollars worth of tokens while also barring its early investors from exiting their positions. Price fell from $700 to $500, those who were watching at the sidelines, saw it as an opportunity to get it for cheap, then it fell to $200, then $30, supporters said it was just a correction, so new people bought in hoping to make all time high again.

After the price fiasco, some researchers did some analysis, it was noticed that Dfinity treasury and project insiders deposited 18.9 million ICP, worth ~$3.6 billion at time of deposit, to Coinbase, Binance, Huobi, and OKEx and that 94% of the 8.3 million in ICP deposits from the Treasury to exchanges occurred on two days: 3.1 million on May 10th (listing day) and 4.7 million on June 15th. So it was an organized scheme to dump on retail investors.

The result of the analysis spread far and wide, panic shook the heart of die hard ICP fans, but they still believe,then the end came, ICP pumped no more, in a bull market, a token has crashed massively. Many retail investors panic and sold. those who believe in it and those who bought at the top are still holding.

On Aug. 9, 2021, Roche Freedman LLP, a law firm filed a class-action lawsuit against the Dfinity Foundation, Dfinity USA Research LLC and Dominic Williams, in federal court in California. The lawsuit alleges that Dfinity, the company behind Internet Computer, misled investors into believing that Dfinity and its insiders would not — and could not — sell their ICP tokens on May 10, 2021, the day that ICP first became tradable on exchanges, or in the weeks that followed. In reality, as alleged, Dfinity and its insiders could — and did — sell massive amounts of ICP during that period, thus securing substantial profits for themselves at the expense of outside investors, while causing the price of ICP to collapse.

Presently ICp is trading at $3.40, those who bought at the top are hoping that ICP can do some magic and beat its ath in the next bull run. They will go on to form a community on various social media platforms telling the world that ICP will be great again.",30,10,2023-06-23 10:18:03,,SatoshiStreetBets,Discussion 🦍,[]
Shiba Inu Goes Mainstream in Japan as SBI Group Enables SHIB Trading," SBI Group, a prominent financial service giant in Japan, has taken a major step into cryptocurrency trading. Through its subsidiary, SBI VC Trade, the company has announced plans to offer trading services for Shiba Inu (SHIB), a digital currency inspired by Dogecoin.   


 [Shiba Inu Goes Mainstream in Japan as SBI Group Enables SHIB Trading - TheNewsCrypto](https://thenewscrypto.com/shiba-inu-goes-mainstream-in-japan-as-sbi-group-enables-shib-trading/) 

&amp;#x200B;",2,2,2023-06-29 05:43:29,,SatoshiStreetBets,News 📰,"[('[removed]', 1), ('/u/Royal-Confection3311, to prevent spam, your SatoshiStreetBets submission has been removed due to your **comment** karma being less than 200. Please remember **comment** karma is different than your total combined karma. You can learn more about the [different types of karma here](https://reddit.zendesk.com/hc/en-us/articles/204511829-What-is-karma-) You can build up comment karma by making quality comments across Reddit. If you have a questions, please feel free to send the SSB moderators a (nice) modmail.\n\n*I am a bot, and this action was performed automatically. Please [contact the moderators of this subreddit](/message/compose/?to=/r/SatoshiStreetBets) if you have any questions or concerns.*', 1), ('[removed]', 1)]"
